"Российский государственный университет им. А.Н. Косыгина (Технологии. Дизайн. Искусство), г. Москва",67.0,4,1120,1073,0,37,10,Да,Российский государственный университет им. А.Н. Косыгина (Технологии. Дизайн. Искусство), Москва
"Российский государственный университет нефти и газа им. И.М. Губкина, г. Москва",79.9,3.5,891,538,30,34,289,Да,Российский государственный университет нефти и газа им. И.М. Губкина, Москва
"Российский государственный университет правосудия, г. Москва",82.8,-1,104,74,1,9,20,Да,Российский государственный университет правосудия, Москва
"Российский государственный университет туризма и сервиса, г. Черкизово",75.7,3.8,129,121,0,8,0,Нет,Российский государственный университет туризма и сервиса, Черкизово
"Российский национальный исследовательский медицинский университет им. Н.И. Пирогова, г. Москва",82.3,0.6,1212,555,57,71,529,Да,Российский национальный исследовательский медицинский университет им. Н.И. Пирогова, Москва
"Российский университет дружбы народов, г. Москва",78.8,2.2,873,760,50,53,10,Да,Российский университет дружбы народов, Москва
"Российский химико-технологический университет им. Д.И. Менделеева, г.Москва",76.3,-0.4,984,900,44,15,25,Да,Российский химико-технологический университет им. Д.И. Менделеева,Москва
"Российский экономический университет им. Г.В. Плеханова, г. Москва",85.8,3.2,730,611,27,48,44,Да,Российский экономический университет им. Г.В. Плеханова, Москва
Ростовский государственный медицинский университет,74.9,-0.7,705,259,0,61,385,Да,Ростовский государственный медицинский университет,Не определено
Ростовский государственный университет путей сообщения,60.1,0.5,666,313,0,14,339,Нет,Ростовский государственный университет путей сообщения,Не определено
"Ростовский государственный экономический университет ""РИНХ""",67.8,-1.7,249,231,0,13,5,Да,"Ростовский государственный экономический университет ""РИНХ""",Не определено
Рыбинский государственный авиационный технический университет им. П.А. Соловьева,54.1,2.1,332,314,0,5,13,Да,Рыбинский государственный авиационный технический университет им. П.А. Соловьева,Не определено
Рязанский государственный агротехнологический университет им. П.А. Костычева,55.0,0.3,409,376,0,9,24,Да,Рязанский государственный агротехнологический университет им. П.А. Костычева,Не определено
Рязанский государственный медицинский университет им. И.П. Павлова,74.5,0.7,435,110,0,24,301,Да,Рязанский государственный медицинский университет им. И.П. Павлова,Не определено
Рязанский государственный радиотехнический университет,62.2,-2,626,277,0,17,332,Нет,Рязанский государственный радиотехнический университет,Не определено
Рязанский государственный университет им. С.А. Есенина,69.1,-0.6,468,370,0,25,73,Да,Рязанский государственный университет им. С.А. Есенина,Не определено
Самарская государственная областная академия (Наяновой),70.6,5.2,55,52,0,3,0,Да,Самарская государственная областная академия (Наяновой),Не определено
Самарская государственная сельскохозяйственная академия,50.5,-0.4,278,228,0,12,38,Нет,Самарская государственная сельскохозяйственная академия,Не определено
Самарский государственный медицинский университет,73.8,-1.4,688,279,0,28,381,Да,Самарский государственный медицинский университет,Не определено
Самарский государственный социально-педагогический университет,71.8,0.2,434,302,1,37,94,Нет,Самарский государственный социально-педагогический университет,Не определено
Самарский государственный технический университет,65.1,-0.5,1739,1618,7,21,93,Нет,Самарский государственный технический университет,Не определено
Самарский государственный университет путей сообщения,53.5,-1.3,711,363,0,16,332,Да,Самарский государственный университет путей сообщения,Не определено
Самарский государственный экономический университет,81.1,1.7,211,187,1,23,0,Нет,Самарский государственный экономический университет,Не определено
Самарский национальный исследовательский университет им. академика С.П. Королева,73.0,0.6,1575,1376,15,31,153,Да,Самарский национальный исследовательский университет им. академика С.П. Королева,Не определено
Санкт-Петербургская государственная академия ветеринарной медицины,71.9,-0.3,380,327,0,18,35,Нет,Санкт-Петербургская государственная академия ветеринарной медицины,Не определено
Санкт-Петербургская государственная химико-фармацевтическая академия,79.7,1.8,290,208,6,8,68,Да,Санкт-Петербургская государственная химико-фармацевтическая академия,Не определено
Санкт-Петербургский горный университет,75.3,-0.2,1522,1350,27,25,120,Да,Санкт-Петербургский горный университет,Не определено
Санкт-Петербургский государственный аграрный университет,59.2,1.2,323,285,0,11,27,Нет,Санкт-Петербургский государственный аграрный университет,Не определено
Санкт-Петербургский государственный архитектурно-строительный университет,74.5,-1.4,896,839,0,27,30,Да,Санкт-Петербургский государственный архитектурно-строительный университет,Не определено
Санкт-Петербургский государственный институт психологии и социальной работы,72.8,2,30,27,0,3,0,Да,Санкт-Петербургский государственный институт психологии и социальной работы,Не определено
Санкт-Петербургский государственный лесотехнический университет им. С.М. Кирова,63.8,1.3,538,503,0,15,20,Нет,Санкт-Петербургский государственный лесотехнический университет им. С.М. Кирова,Не определено
Санкт-Петербургский государственный морской технический университет,61.4,3.3,799,594,0,16,189,Нет,Санкт-Петербургский государственный морской технический университет,Не определено
Санкт-Петербургский государственный педиатрический медицинский университет,81.3,-0.1,455,215,16,17,207,Да,Санкт-Петербургский государственный педиатрический медицинский университет,Не определено
Санкт-Петербургский государственный технологический институт (технический университет),71.0,-0.3,575,542,0,8,25,Нет,Санкт-Петербургский государственный технологический институт (технический университет),Не определено
Санкт-Петербургский государственный университет,90.7,0.7,1927,1497,335,90,5,Да,Санкт-Петербургский государственный университет,Не определено
Санкт-Петербургский государственный университет аэрокосмического приборостроения,70.4,4.8,1126,605,2,10,509,Нет,Санкт-Петербургский государственный университет аэрокосмического приборостроения,Не определено
Санкт-Петербургский государственный университет гражданской авиации,67.8,1.5,440,260,1,8,171,Нет,Санкт-Петербургский государственный университет гражданской авиации,Не определено
Санкт-Петербургский государственный университет промышленных технологий и дизайна,74.8,0.2,975,753,196,24,2,Да,Санкт-Петербургский государственный университет промышленных технологий и дизайна,Не определено
Санкт-Петербургский государственный университет телекоммуникаций им. М.А. Бонч-Бруевича,72.1,2.7,747,683,0,18,46,Нет,Санкт-Петербургский государственный университет телекоммуникаций им. М.А. Бонч-Бруевича,Не определено
Санкт-Петербургский государственный экономический университет,81.3,2.6,649,568,14,50,17,Нет,Санкт-Петербургский государственный экономический университет,Не определено
Санкт-Петербургский государственный электротехнический университет “ЛЭТИ”,79.7,2.2,1389,1176,21,19,173,Да,Санкт-Петербургский государственный электротехнический университет “ЛЭТИ”,Не определено
Санкт-Петербургский национальный исследовательский Академический университет РАН,96.4,2.9,60,25,33,2,0,Да,Санкт-Петербургский национальный исследовательский Академический университет РАН,Не определено
Санкт-Петербургский политехнический университет Петра Великого,78.3,1.3,2723,2366,58,95,204,Да,Санкт-Петербургский политехнический университет Петра Великого,Не определено
Саратовская государственная юридическая академия,79.1,-20.9,544,377,1,0,166,Нет,Саратовская государственная юридическая академия,Не определено
Саратовский государственный аграрный университет им. Н.И. Вавилова,53.2,2.2,725,399,0,66,260,Нет,Саратовский государственный аграрный университет им. Н.И. Вавилова,Не определено
Саратовский государственный медицинский университет,74.6,-0.2,620,296,0,41,283,Да,Саратовский государственный медицинский университет,Не определено
Саратовский государственный технический университет,63.9,1.3,882,784,2,12,84,Нет,Саратовский государственный технический университет,Не определено
Саратовский национальный исследовательский государственный университет им. Н. Г. Чернышевского,66.1,0.8,1481,1377,0,65,39,Да,Саратовский национальный исследовательский государственный университет им. Н. Г. Чернышевского,Не определено
Саратовский социально-экономический институт (филиал) РЭУ имени Г.В. Плеханова,74.4,0.5,185,169,0,5,11,Нет,Саратовский социально-экономический институт (филиал) РЭУ имени Г.В. Плеханова,Не определено
"Сахалинский государственный университет, г. Южно-Сахалинск",58.1,0.4,325,293,0,24,8,Нет,Сахалинский государственный университет, Южно-Сахалинск
Севастопольский государственный университет,62.6,,1457,1400,1,42,14,Да,Севастопольский государственный университет,Не определено
Северный (Арктический) федеральный университет им. М.В. Ломоносова,64.2,1.7,1359,1208,0,58,93,Нет,Северный (Арктический) федеральный университет им. М.В. Ломоносова,Не определено
"Северный государственный медицинский университет, г. Архангельск",72.9,0.3,378,104,0,17,257,Да,"Северный государственный медицинский университет, г. Архангельск",Не определено
"Северо-Восточный государственный университет, г. Магадан",55.7,-2.4,245,226,0,12,7,Нет,Северо-Восточный государственный университет, Магадан
Северо-Восточный федеральный университет им. М.К. Аммосова,62.5,-0.1,1727,1273,8,92,354,Да,Северо-Восточный федеральный университет им. М.К. Аммосова,Не определено
"Северо-Западный государственный медицинский университет им. И.И.Мечникова, г. Санкт-Петербург",78.4,-2.1,500,138,0,30,332,Да,Северо-Западный государственный медицинский университет им. И.И.Мечникова, Санкт-Петербург
"Северо-Западный институт управления - филиал РАНХиГС, г. Санкт-Петербург",82.1,2.3,209,166,8,23,12,Да,Северо-Западный институт управления - филиал РАНХиГС, Санкт-Петербург
"Северо-Кавказская государственная гуманитарно-технологическая академия, г. Черкесск",64.3,4.9,321,302,0,19,0,Нет,Северо-Кавказская государственная гуманитарно-технологическая академия, Черкесск
"Северо-Кавказский горно-металлургический институт (государственный технологический университет) , г. Владикавказ",51.2,-0.7,572,534,0,15,23,Да,Северо-Кавказский горно-металлургический институт (государственный технологический университет) , Владикавказ
Северо-Кавказский федеральный университет,66.7,0.5,1379,1091,0,85,203,Да,Северо-Кавказский федеральный университет,Не определено
"Северо-Осетинская государственная медицинская академия, г. Владикавказ",68.4,-0.2,326,135,0,30,161,Да,Северо-Осетинская государственная медицинская академия, Владикавказ
"Северо-Осетинский государственный педагогический институт, г. Владикавказ",53.8,0.8,148,135,0,3,10,Нет,Северо-Осетинский государственный педагогический институт, Владикавказ
"Северо-Осетинский государственный университет им. К.Л. Хетагурова, г. Владикавказ",61.5,-0.2,506,456,0,40,10,Нет,Северо-Осетинский государственный университет им. К.Л. Хетагурова, Владикавказ
"Сибирская государственная автомобильно-дорожная академия, г. Омск",55.2,-2.1,470,442,0,24,4,Нет,Сибирская государственная автомобильно-дорожная академия, Омск
"Сибирский государственный индустриальный университет, г. Новокузнецк",58.3,-2.2,620,570,0,47,3,Нет,Сибирский государственный индустриальный университет, Новокузнецк
"Сибирский государственный медицинский университет,  г. Томск",74.4,-2,783,413,23,33,314,Да,"Сибирский государственный медицинский университет,  г. Томск",Не определено
Сибирский государственный университет водного транспорта,53.6,0.6,577,530,0,9,38,Да,Сибирский государственный университет водного транспорта,Не определено
"Сибирский государственный университет геосистем и технологий, г. Новосибирск",67.1,0.5,383,331,0,22,30,Нет,Сибирский государственный университет геосистем и технологий, Новосибирск
"Сибирский государственный университет науки и технологий им. М.Ф. Решетнева, г. Красноярск",57.7,-2.9,1596,1382,2,72,140,Да,Сибирский государственный университет науки и технологий им. М.Ф. Решетнева, Красноярск
"Сибирский государственный университет путей сообщения, г. Новосибирск",64.6,1.2,484,244,0,14,226,Да,Сибирский государственный университет путей сообщения, Новосибирск
"Сибирский государственный университет телекоммуникаций и информатики, г. Новосибирск",67.7,0.9,515,360,1,7,147,Да,Сибирский государственный университет телекоммуникаций и информатики, Новосибирск
"Сибирский институт управления - филиал РАНХиГС, г. Новосибирск",77.6,-0.4,77,60,0,9,8,Да,Сибирский институт управления - филиал РАНХиГС, Новосибирск
Сибирский федеральный университет,65.8,-0.8,3326,3041,11,154,120,Да,Сибирский федеральный университет,Не определено
Смоленская государственная сельскохозяйственная академия,54.9,1.9,115,90,0,10,15,Нет,Смоленская государственная сельскохозяйственная академия,Не определено
Смоленский государственный медицинский университет,74.2,-0.4,409,193,0,14,202,Да,Смоленский государственный медицинский университет,Не определено
Смоленский государственный университет,69.7,0.5,465,425,1,26,13,Нет,Смоленский государственный университет,Не определено
Сочинский государственный университет,65.4,1.1,311,275,0,18,18,Нет,Сочинский государственный университет,Не определено
"Среднерусский институт управления - филиал РАНХиГС, г. Орел",69.8,0.8,105,99,0,0,6,Да,Среднерусский институт управления - филиал РАНХиГС, Орел
Ставропольский государственный аграрный университет,59.9,2.9,518,402,0,35,81,Да,Ставропольский государственный аграрный университет,Не определено
Ставропольский государственный медицинский университет,71.2,2.3,422,102,0,30,290,Да,Ставропольский государственный медицинский университет,Не определено
Ставропольский государственный педагогический институт,68.7,0.8,301,205,0,13,83,Нет,Ставропольский государственный педагогический институт,Не определено
Сургутский государственный педагогический университет,60.6,-1.1,436,316,0,13,107,Нет,Сургутский государственный педагогический университет,Не определено
Сургутский государственный университет Ханты-Мансийского автономного округа — Югры,64.9,2.2,734,651,0,36,47,Нет,Сургутский государственный университет Ханты-Мансийского автономного округа — Югры,Не определено
Сыктывкарский государственный университет,64.9,0.1,734,590,0,50,94,Нет,Сыктывкарский государственный университет,Не определено
Тамбовский государственный технический университет,57.8,-1.2,430,353,0,13,64,Нет,Тамбовский государственный технический университет,Не определено
Тамбовский государственный университет им. Г.Р. Державина,66.3,2.8,529,425,0,49,55,Нет,Тамбовский государственный университет им. Г.Р. Державина,Не определено
Тверская государственная сельскохозяйственная академия,48.8,2.3,115,106,0,8,1,Нет,Тверская государственная сельскохозяйственная академия,Не определено
